{
  "source": "mastodon",
  "source_name": "Mastodon",
  "source_id": "114000000000000001",
  "source_url": "https://social.example/@example/114000000000000001",
  "author": "@example@social.example",
  "created_at": "2026-08-30T09:17:00Z",
  "text": "A status with one locally archived attachment. #socialposts #pesos",
  "media": [
    {
      "url": "https://media.example/mastodon-image.webp",
      "kind": "image",
      "alt": "A blue notebook beside a mechanical pencil"
    }
  ],
  "trigger_tag": "socialposts",
  "language": "en"
}
