{
  "source": "bluesky",
  "source_name": "Bluesky",
  "source_id": "3exampleblueskypost",
  "source_url": "https://bsky.app/profile/example.test/post/3exampleblueskypost",
  "author": "example.test",
  "created_at": "2026-08-30T09:15:00Z",
  "text": "A short note that belongs in the archive. #socialposts #indieweb",
  "trigger_tag": "socialposts",
  "language": "en"
}
