{
  "source": "twitter",
  "source_name": "Twitter/X",
  "source_id": "196000000000000001",
  "source_url": "https://x.com/example/status/196000000000000001",
  "author": "example",
  "created_at": "2026-08-30T09:20:00Z",
  "text": "This adapter supplied an expanded https://example.org/essay link. #socialposts #indieweb",
  "trigger_tag": "socialposts",
  "language": "en"
}
